[
  {
    "player_a": "Binni",
    "player_b": "Einar",
    "a_wins": 2,
    "b_wins": 3,
    "by_cube": [
      {
        "cube": "Meta Memories",
        "a_wins": 2,
        "b_wins": 1
      },
      {
        "cube": "Synergy Cube",
        "a_wins": 0,
        "b_wins": 2
      }
    ]
  },
  {
    "player_a": "Binni",
    "player_b": "Ingvi",
    "a_wins": 0,
    "b_wins": 2,
    "by_cube": [
      {
        "cube": "Meta Memories",
        "a_wins": 0,
        "b_wins": 2
      }
    ]
  },
  {
    "player_a": "Aron Freyr",
    "player_b": "Binni",
    "a_wins": 6,
    "b_wins": 7,
    "by_cube": [
      {
        "cube": "Meta Memories",
        "a_wins": 0,
        "b_wins": 2
      },
      {
        "cube": "Synergy Cube",
        "a_wins": 2,
        "b_wins": 0
      },
      {
        "cube": "Bolti",
        "a_wins": 0,
        "b_wins": 2
      },
      {
        "cube": "Modern Stories",
        "a_wins": 2,
        "b_wins": 1
      },
      {
        "cube": "Vintage Aron",
        "a_wins": 0,
        "b_wins": 2
      },
      {
        "cube": "Genesis",
        "a_wins": 2,
        "b_wins": 0
      }
    ]
  },
  {
    "player_a": "Aron Elvar",
    "player_b": "Aron Ívars",
    "a_wins": 5,
    "b_wins": 2,
    "by_cube": [
      {
        "cube": "Meta Memories",
        "a_wins": 1,
        "b_wins": 2
      },
      {
        "cube": "Final Destination",
        "a_wins": 2,
        "b_wins": 0
      },
      {
        "cube": "Vintage Aron",
        "a_wins": 2,
        "b_wins": 0
      }
    ]
  },
  {
    "player_a": "Diddi",
    "player_b": "Einar",
    "a_wins": 4,
    "b_wins": 5,
    "by_cube": [
      {
        "cube": "Meta Memories",
        "a_wins": 1,
        "b_wins": 2
      },
      {
        "cube": "Genesis",
        "a_wins": 0,
        "b_wins": 2
      },
      {
        "cube": "Modern Stories",
        "a_wins": 2,
        "b_wins": 1
      },
      {
        "cube": "That's Totally Uncommon",
        "a_wins": 1,
        "b_wins": 0
      }
    ]
  },
  {
    "player_a": "Diddi",
    "player_b": "Ingvi",
    "a_wins": 5,
    "b_wins": 3,
    "by_cube": [
      {
        "cube": "Meta Memories",
        "a_wins": 2,
        "b_wins": 0
      },
      {
        "cube": "Nerva's Cube",
        "a_wins": 2,
        "b_wins": 1
      },
      {
        "cube": "Genesis",
        "a_wins": 1,
        "b_wins": 2
      }
    ]
  },
  {
    "player_a": "Aron Freyr",
    "player_b": "Diddi",
    "a_wins": 13,
    "b_wins": 10,
    "by_cube": [
      {
        "cube": "Meta Memories",
        "a_wins": 4,
        "b_wins": 7
      },
      {
        "cube": "Boltalandið",
        "a_wins": 1,
        "b_wins": 2
      },
      {
        "cube": "Modern Stories",
        "a_wins": 2,
        "b_wins": 1
      },
      {
        "cube": "Vintage Victor",
        "a_wins": 2,
        "b_wins": 0
      },
      {
        "cube": "That's Totally Uncommon",
        "a_wins": 2,
        "b_wins": 0
      },
      {
        "cube": "Diddi's Vintage Vanilla",
        "a_wins": 2,
        "b_wins": 0
      }
    ]
  },
  {
    "player_a": "Hjalti",
    "player_b": "Styrmir",
    "a_wins": 0,
    "b_wins": 2,
    "by_cube": [
      {
        "cube": "Meta Memories",
        "a_wins": 0,
        "b_wins": 2
      }
    ]
  },
  {
    "player_a": "Aron Ívars",
    "player_b": "Hjalti",
    "a_wins": 1,
    "b_wins": 6,
    "by_cube": [
      {
        "cube": "Meta Memories",
        "a_wins": 0,
        "b_wins": 2
      },
      {
        "cube": "Vintage Aron",
        "a_wins": 0,
        "b_wins": 2
      },
      {
        "cube": "Bolti",
        "a_wins": 1,
        "b_wins": 2
      }
    ]
  },
  {
    "player_a": "Oddur",
    "player_b": "Styrmir",
    "a_wins": 3,
    "b_wins": 5,
    "by_cube": [
      {
        "cube": "Meta Memories",
        "a_wins": 2,
        "b_wins": 1
      },
      {
        "cube": "Stone Soup Cube",
        "a_wins": 1,
        "b_wins": 4
      }
    ]
  },
  {
    "player_a": "Aron Freyr",
    "player_b": "Tommi",
    "a_wins": 15,
    "b_wins": 11,
    "by_cube": [
      {
        "cube": "Meta Memories",
        "a_wins": 6,
        "b_wins": 4
      },
      {
        "cube": "Bolti",
        "a_wins": 4,
        "b_wins": 2
      },
      {
        "cube": "Final Destination",
        "a_wins": 0,
        "b_wins": 2
      },
      {
        "cube": "That's Totally Uncommon",
        "a_wins": 1,
        "b_wins": 2
      },
      {
        "cube": "Flashdance!",
        "a_wins": 2,
        "b_wins": 0
      },
      {
        "cube": "Pauper Cube Victor",
        "a_wins": 2,
        "b_wins": 1
      }
    ]
  },
  {
    "player_a": "Einar",
    "player_b": "Tommi",
    "a_wins": 5,
    "b_wins": 6,
    "by_cube": [
      {
        "cube": "Meta Memories",
        "a_wins": 3,
        "b_wins": 2
      },
      {
        "cube": "Nerva's Cube",
        "a_wins": 1,
        "b_wins": 2
      },
      {
        "cube": "That's Totally Uncommon",
        "a_wins": 1,
        "b_wins": 2
      }
    ]
  },
  {
    "player_a": "Ingvi",
    "player_b": "Tommi",
    "a_wins": 6,
    "b_wins": 6,
    "by_cube": [
      {
        "cube": "Meta Memories",
        "a_wins": 1,
        "b_wins": 2
      },
      {
        "cube": "Stone Soup Cube",
        "a_wins": 1,
        "b_wins": 2
      },
      {
        "cube": "Bolti",
        "a_wins": 2,
        "b_wins": 1
      },
      {
        "cube": "Stingvi Power Max",
        "a_wins": 2,
        "b_wins": 1
      }
    ]
  },
  {
    "player_a": "Anna",
    "player_b": "Binni",
    "a_wins": 2,
    "b_wins": 4,
    "by_cube": [
      {
        "cube": "Khans Cube",
        "a_wins": 1,
        "b_wins": 2
      },
      {
        "cube": "Stone Soup Cube",
        "a_wins": 1,
        "b_wins": 2
      }
    ]
  },
  {
    "player_a": "Binni",
    "player_b": "Tommi",
    "a_wins": 8,
    "b_wins": 7,
    "by_cube": [
      {
        "cube": "Khans Cube",
        "a_wins": 0,
        "b_wins": 2
      },
      {
        "cube": "Synergy Cube",
        "a_wins": 2,
        "b_wins": 1
      },
      {
        "cube": "Boltalandið",
        "a_wins": 2,
        "b_wins": 0
      },
      {
        "cube": "Meta Memories",
        "a_wins": 0,
        "b_wins": 2
      },
      {
        "cube": "Pauper Cube Victor",
        "a_wins": 2,
        "b_wins": 1
      },
      {
        "cube": "Vintage Aron",
        "a_wins": 2,
        "b_wins": 1
      }
    ]
  },
  {
    "player_a": "Arnar",
    "player_b": "Tommi",
    "a_wins": 3,
    "b_wins": 5,
    "by_cube": [
      {
        "cube": "Khans Cube",
        "a_wins": 0,
        "b_wins": 2
      },
      {
        "cube": "Final Destination",
        "a_wins": 2,
        "b_wins": 1
      },
      {
        "cube": "Flashdance!",
        "a_wins": 1,
        "b_wins": 2
      }
    ]
  },
  {
    "player_a": "Diddi",
    "player_b": "Oddur",
    "a_wins": 12,
    "b_wins": 8,
    "by_cube": [
      {
        "cube": "Khans Cube",
        "a_wins": 2,
        "b_wins": 0
      },
      {
        "cube": "Final Destination",
        "a_wins": 1,
        "b_wins": 2
      },
      {
        "cube": "Kaldheim Cube",
        "a_wins": 1,
        "b_wins": 2
      },
      {
        "cube": "Stone Soup Cube",
        "a_wins": 2,
        "b_wins": 0
      },
      {
        "cube": "Old Border Cube",
        "a_wins": 2,
        "b_wins": 0
      },
      {
        "cube": "Genesis",
        "a_wins": 1,
        "b_wins": 1
      },
      {
        "cube": "Meta Memories",
        "a_wins": 2,
        "b_wins": 1
      },
      {
        "cube": "Flashdance!",
        "a_wins": 1,
        "b_wins": 2
      }
    ]
  },
  {
    "player_a": "Arnar",
    "player_b": "Einar",
    "a_wins": 5,
    "b_wins": 3,
    "by_cube": [
      {
        "cube": "Khans Cube",
        "a_wins": 2,
        "b_wins": 0
      },
      {
        "cube": "Stone Soup Cube",
        "a_wins": 2,
        "b_wins": 1
      },
      {
        "cube": "Vintage Victor",
        "a_wins": 1,
        "b_wins": 2
      }
    ]
  },
  {
    "player_a": "Aron Gauti",
    "player_b": "Oddur",
    "a_wins": 0,
    "b_wins": 2,
    "by_cube": [
      {
        "cube": "Khans Cube",
        "a_wins": 0,
        "b_wins": 2
      }
    ]
  },
  {
    "player_a": "Arnar",
    "player_b": "Oddur",
    "a_wins": 2,
    "b_wins": 0,
    "by_cube": [
      {
        "cube": "Khans Cube",
        "a_wins": 2,
        "b_wins": 0
      }
    ]
  },
  {
    "player_a": "Aron Gauti",
    "player_b": "Einar",
    "a_wins": 2,
    "b_wins": 4,
    "by_cube": [
      {
        "cube": "Khans Cube",
        "a_wins": 1,
        "b_wins": 2
      },
      {
        "cube": "Synergy Cube",
        "a_wins": 1,
        "b_wins": 2
      }
    ]
  },
  {
    "player_a": "Anna",
    "player_b": "Aron Gauti",
    "a_wins": 5,
    "b_wins": 4,
    "by_cube": [
      {
        "cube": "Khans Cube",
        "a_wins": 1,
        "b_wins": 2
      },
      {
        "cube": "Synergy Cube",
        "a_wins": 2,
        "b_wins": 1
      },
      {
        "cube": "The Ab Wheel",
        "a_wins": 2,
        "b_wins": 1
      }
    ]
  },
  {
    "player_a": "Diddi",
    "player_b": "Tommi",
    "a_wins": 12,
    "b_wins": 10,
    "by_cube": [
      {
        "cube": "Stone Soup Cube",
        "a_wins": 3,
        "b_wins": 4
      },
      {
        "cube": "Final Destination",
        "a_wins": 2,
        "b_wins": 1
      },
      {
        "cube": "Nerva's Cube",
        "a_wins": 3,
        "b_wins": 2
      },
      {
        "cube": "Meta Memories",
        "a_wins": 0,
        "b_wins": 2
      },
      {
        "cube": "Boltalandið",
        "a_wins": 2,
        "b_wins": 0
      },
      {
        "cube": "Flashdance!",
        "a_wins": 2,
        "b_wins": 1
      }
    ]
  },
  {
    "player_a": "Arnar",
    "player_b": "Styrmir",
    "a_wins": 2,
    "b_wins": 0,
    "by_cube": [
      {